{
  "version": "0.1.0",
  "lastUpdate": "2026-08-24T00:00:00.000Z",
  "count": 11,
  "source": "https://observatorioia.org",
  "license": "CC BY 4.0",
  "data": {
    "schemaVersion": 3,
    "fechaCorte": "2026-08-24",
    "alcance": {
      "es": "Diccionario público del contrato, los vocabularios y las reglas editoriales usadas para interpretar los datos del Observatorio IA Costa Rica.",
      "en": "Public dictionary for the contract, vocabularies and editorial rules used to interpret AI Observatory Costa Rica data."
    },
    "contrato": {
      "envoltura": [
        {
          "campo": "version",
          "descripcion": {
            "es": "Versión de la aplicación que generó el archivo. No identifica por sí sola una release de datos.",
            "en": "Version of the application that generated the file. It does not identify a data release by itself."
          }
        },
        {
          "campo": "lastUpdate",
          "descripcion": {
            "es": "Último cambio editorial conocido del conjunto, no la hora de compilación.",
            "en": "Latest known editorial change to the dataset, not the build time."
          }
        },
        {
          "campo": "count",
          "descripcion": {
            "es": "Cantidad expresada en la unidad propia del conjunto.",
            "en": "Quantity expressed in the dataset's declared unit."
          }
        },
        {
          "campo": "source",
          "descripcion": {
            "es": "Entidad responsable de la compilación publicada.",
            "en": "Entity responsible for the published compilation."
          }
        },
        {
          "campo": "license",
          "descripcion": {
            "es": "Licencia de la compilación del Observatorio. Los documentos enlazados conservan sus propios derechos.",
            "en": "License for the Observatory compilation. Linked source documents retain their own rights."
          }
        },
        {
          "campo": "data",
          "descripcion": {
            "es": "Contenido completo del conjunto en su estructura natural.",
            "en": "Complete dataset content in its natural structure."
          }
        }
      ],
      "bilinguismo": {
        "es": "Los textos editoriales traducibles usan objetos con claves es y en. Nombres propios, identificadores, URLs, fechas, números y transcripciones fuente pueden permanecer como valores planos.",
        "en": "Translatable editorial text uses objects with es and en keys. Proper names, identifiers, URLs, dates, numbers and source transcriptions may remain scalar values."
      },
      "noDeterminado": {
        "es": "Indica que la evidencia pública revisada no permite confirmar ni descartar una afirmación. No equivale a no, cero ni inexistente, y exige una pregunta abierta o próxima revisión.",
        "en": "Means that reviewed public evidence cannot confirm or rule out a claim. It does not mean no, zero or nonexistent, and it requires an open question or next review."
      },
      "noAplica": {
        "es": "Indica que la dimensión no corresponde al objeto documentado. Por ejemplo, un programa de formación puede estar operativo sin que exista una técnica o un uso operativo de IA que evaluar.",
        "en": "Means that the dimension does not correspond to the documented object. For example, a training program may be operational without there being an AI technique or operational AI use to assess."
      },
      "trazabilidad": {
        "es": "Sin errores de trazabilidad significa que no hay IDs de fuente duplicados; toda evaluación afirmativa referencia una fuente existente que respalda esa dimensión; y todo resultado verificado referencia una fuente declarada para resultados. Una adopción verificada exige además que una fuente primaria oficial o de acceso a información respalde la ejecución. Las relaciones entre iniciativas también se validan contra IDs existentes y no pueden apuntar al mismo registro.",
        "en": "No traceability errors means there are no duplicate source IDs; every affirmative assessment references an existing source that supports that dimension; and every verified result references a source declared for results. Verified adoption also requires an official primary or access-to-information source supporting execution. Initiative relationships are also checked against existing IDs and cannot point to the same record."
      }
    },
    "politicaPublicacion": {
      "release": {
        "es": "Los datasets sustantivos se congelan en cortes inmutables con manifest, schemas y checksums. Una modificación exige una nueva release.",
        "en": "Substantive datasets are frozen in immutable releases with a manifest, schemas and checksums. Any modification requires a new release."
      },
      "rolling": {
        "es": "Las bitácoras operativas append-only se sirven en su endpoint vivo y conservan fecha editorial, schema, issue y commit cuando corresponde. No se duplican en cada corte sustantivo.",
        "en": "Append-only operational logs are served from their live endpoint and retain editorial date, schema, issue and commit when applicable. They are not duplicated in every substantive release."
      },
      "datasetsRodantes": [
        "monitoreo"
      ]
    },
    "reglaAdopcionVerificada": {
      "descripcion": {
        "es": "Una iniciativa cuenta como adopción verificada solo cuando cumple simultáneamente todas las condiciones. estadoCatalogo y estadoIA por sí solos no bastan: estadoIA registra la relación explícita con IA en la fuente, mientras evaluacion.tecnicaIA confirma la técnica.",
        "en": "An initiative counts as verified adoption only when it meets every condition simultaneously. estadoCatalogo and estadoIA are not sufficient on their own: estadoIA records an explicit relationship to AI in the source, while evaluacion.tecnicaIA confirms the technique."
      },
      "condiciones": [
        {
          "campo": "modeloVersion",
          "operador": "igual",
          "valores": [
            2
          ]
        },
        {
          "campo": "estadoCatalogo",
          "operador": "igual",
          "valores": [
            "verificado"
          ]
        },
        {
          "campo": "tipoIniciativa",
          "operador": "uno-de",
          "valores": [
            "sistema-ia",
            "componente-ia"
          ]
        },
        {
          "campo": "faseImplementacion",
          "operador": "uno-de",
          "valores": [
            "piloto",
            "operativo"
          ]
        },
        {
          "campo": "estadoIA",
          "operador": "igual",
          "valores": [
            "confirmada"
          ]
        },
        {
          "campo": "evaluacion.tecnicaIA.estado",
          "operador": "igual",
          "valores": [
            "confirmado"
          ]
        },
        {
          "campo": "evaluacion.ejecucion.estado",
          "operador": "igual",
          "valores": [
            "confirmado"
          ]
        },
        {
          "campo": "fuentePrimariaEjecucion",
          "operador": "igual",
          "valores": [
            true
          ]
        },
        {
          "campo": "trazabilidad",
          "operador": "sin-errores",
          "valores": []
        }
      ]
    },
    "vocabularios": [
      {
        "id": "tipoIniciativa",
        "campo": "proyectos[].tipoIniciativa",
        "valores": [
          {
            "valor": "sistema-ia",
            "etiqueta": {
              "es": "Sistema de IA",
              "en": "AI system"
            }
          },
          {
            "valor": "componente-ia",
            "etiqueta": {
              "es": "Componente de IA",
              "en": "AI component"
            }
          },
          {
            "valor": "infraestructura-digital",
            "etiqueta": {
              "es": "Infraestructura digital",
              "en": "Digital infrastructure"
            }
          },
          {
            "valor": "programa-capacidades",
            "etiqueta": {
              "es": "Programa de capacidades",
              "en": "Capacity program"
            }
          },
          {
            "valor": "investigacion",
            "etiqueta": {
              "es": "Investigación",
              "en": "Research"
            }
          },
          {
            "valor": "politica-gobernanza",
            "etiqueta": {
              "es": "Política o gobernanza",
              "en": "Policy or governance"
            }
          },
          {
            "valor": "digitalizacion-no-ia",
            "etiqueta": {
              "es": "Digitalización sin IA confirmada",
              "en": "Digitalization without confirmed AI"
            }
          },
          {
            "valor": "por-determinar",
            "etiqueta": {
              "es": "Por determinar",
              "en": "To be determined"
            }
          }
        ]
      },
      {
        "id": "estadoCatalogo",
        "campo": "proyectos[].estadoCatalogo",
        "valores": [
          {
            "valor": "verificado",
            "etiqueta": {
              "es": "Verificado",
              "en": "Verified"
            }
          },
          {
            "valor": "seguimiento",
            "etiqueta": {
              "es": "En seguimiento",
              "en": "Under review"
            }
          },
          {
            "valor": "ecosistema",
            "etiqueta": {
              "es": "Ecosistema y capacidades",
              "en": "Ecosystem and capacities"
            }
          },
          {
            "valor": "descartado",
            "etiqueta": {
              "es": "Descartado",
              "en": "Excluded"
            }
          }
        ]
      },
      {
        "id": "faseImplementacion",
        "campo": "proyectos[].faseImplementacion",
        "valores": [
          {
            "valor": "anunciado",